{
  "$schema": "https://json-schema.org/draft/2020-12/schema",
  "$id": "metewand://schemas/v1/datamonger-acquisition-response.schema.json",
  "x-metewand-compatibility-version": 1,
  "title": "Datamonger acquisition command response",
  "type": "object",
  "properties": {
    "version": {
      "const": 1
    },
    "dataset_id": {
      "type": "string",
      "pattern": "^[a-z0-9][a-z0-9._-]*:[a-z0-9][a-z0-9._-]*@[A-Za-z0-9][A-Za-z0-9._+\\-]*$"
    },
    "dataset_version": {
      "type": "string",
      "minLength": 1
    },
    "registry": {
      "type": "object",
      "properties": {
        "schema_version": {
          "const": 1
        },
        "release": {
          "type": "string",
          "pattern": "^[a-z0-9][a-z0-9._-]*$",
          "not": {
            "enum": [
              "latest",
              "current",
              "default"
            ]
          }
        },
        "index_sha256": {
          "$ref": "common.schema.json#/$defs/sha256"
        },
        "index_url": {
          "type": "string",
          "pattern": "^https?://[^/]+/"
        }
      },
      "required": [
        "schema_version",
        "release",
        "index_sha256",
        "index_url"
      ],
      "additionalProperties": false
    },
    "representation": {
      "type": "object"
    },
    "artifacts": {
      "type": "array",
      "minItems": 1,
      "items": {
        "type": "object",
        "properties": {
          "name": {
            "type": "string",
            "pattern": "^[a-z0-9][a-z0-9._-]*$"
          },
          "path": {
            "$ref": "common.schema.json#/$defs/repository_path"
          },
          "size_bytes": {
            "$ref": "common.schema.json#/$defs/safe_nonnegative_integer"
          },
          "sha256": {
            "$ref": "common.schema.json#/$defs/sha256"
          },
          "format": {
            "type": "string",
            "minLength": 1
          },
          "compression": {
            "type": "string",
            "minLength": 1
          }
        },
        "required": [
          "name",
          "path",
          "size_bytes",
          "sha256",
          "format",
          "compression"
        ],
        "additionalProperties": false
      }
    },
    "verification": {
      "enum": [
        "artifact",
        "decoded"
      ]
    },
    "canonical_form": {
      "type": [
        "integer",
        "null"
      ],
      "minimum": 1
    },
    "canonical_digest": {
      "oneOf": [
        {
          "$ref": "common.schema.json#/$defs/sha256"
        },
        {
          "type": "null"
        }
      ]
    },
    "client": {
      "type": "object",
      "properties": {
        "name": {
          "const": "datamonger-python"
        },
        "version": {
          "type": "string",
          "minLength": 1
        }
      },
      "required": [
        "name",
        "version"
      ],
      "additionalProperties": false
    }
  },
  "required": [
    "version",
    "dataset_id",
    "dataset_version",
    "registry",
    "representation",
    "artifacts",
    "verification",
    "canonical_form",
    "canonical_digest",
    "client"
  ],
  "additionalProperties": false,
  "allOf": [
    {
      "if": {
        "properties": {
          "verification": {
            "const": "decoded"
          }
        }
      },
      "then": {
        "properties": {
          "canonical_form": {
            "const": 1
          },
          "canonical_digest": {
            "$ref": "common.schema.json#/$defs/sha256"
          }
        }
      },
      "else": {
        "properties": {
          "canonical_form": {
            "type": "null"
          },
          "canonical_digest": {
            "type": "null"
          }
        }
      }
    }
  ]
}
