{"artifacts":[{"compression":"none","format":"csv","name":"data","path":"artifacts/data","sha256":"398691f9ae1cc7dd7f4b7807369311a057ce75d7ef55442350ab7fe46d69edbb","size_bytes":12}],"canonical_digest":"69abd67c3fa8b7ea2992b7a5091adf6626066bd2cb1e3e2e92222de8cc0fedfa","canonical_form":1,"client":{"name":"datamonger-python","version":"test-client-v1"},"dataset_id":"test:numbers@1","dataset_version":"1","registry":{"index_sha256":"1111111111111111111111111111111111111111111111111111111111111111","index_url":"https://example.invalid/index.json","release":"metewand-test-1","schema_version":1},"representation":{"decoder":"delimited-text","decoder_version":1,"expect":{"verification":[{"algorithm":"sha256","canonical_form":1,"digest":"69abd67c3fa8b7ea2992b7a5091adf6626066bd2cb1e3e2e92222de8cc0fedfa"}]},"inputs":{"data":"data"},"options":{"delimiter":",","header":true}},"verification":"decoded","version":1}